id,title,img,price,category
2096,"IFOOTAGE Video Fluid Head, Video Tripod Head for Photography, Aluminum Fluid Drag Pan Head, Lightweight Tripod Head with Quick Release Plate, for DSLR Camera, Camcorder, Monopod & Tripod, Komodo K5S",61Wt95iEKJL._AC_UL320_.jpg,149.0,Camera & Photo
2097,"KODAK PIXPRO AZ425 Astro Zoom 20MP Digital Camera (Black) Bundle with 32GB SD Card, Holster Case and Accessory Kit, Battery and Charger Kit, Cable, and Tripod (6 Items)",71hBppjA+BL._AC_UL320_.jpg,249.99,Camera & Photo
2098,"19 inch Ring Light Kit, 60W LED Ring Light with LCD Screen, Support 2.4G Remote and Multiple Lights Control, CRI>97, 3000K-5800K, Tripod Included for Makeup, YouTube Video, Barber, Tiktok Live",71YK0dxzRkL._AC_UL320_.jpg,129.89,Camera & Photo
2099,"Digital Cameras for Photography, 4K 48MP Video Camera, 16X Digital Zoom Vlogging Camera for YouTube, Travel Camera with 32GB SD Card and Wide Angle Lens Macro Lens",71pCUNw12SL._AC_UL320_.jpg,149.99,Camera & Photo
2100,"NEEWER CB150 150W LED Video Light, 5600K Daylight COB Continuous Output Lighting with Bowens Mount/2.4G Remote 13000lux/1m CRI/TLCI97+ for Video Recording Stuido Outdoor Photography Shooting",71GU7YllTdL._AC_UL320_.jpg,199.49,Camera & Photo
2101,"Olympus OM SYSTEM OLYMPUS M.Zuiko Digital ED 40-150mm F2.8 PRO For Micro Four Thirds System Camera, Light weight powerful zoom, Weather Sealed Design, MF Clutch, Compatible with Teleconverter",810y4Wc9nWL._AC_UL320_.jpg,1499.99,Camera & Photo
2102,"12 Pack Disposable Camera for Wedding Single Use Film Camera with Flash for Wedding, Anniversary, Travel, Camp, Party Supply (Yellow Rose)",81v+ePn+aIL._AC_UL320_.jpg,173.99,Camera & Photo
2103,Fujifilm Fujinon XF23mmF1.4 R LM WR,71GD8bAUMdL._AC_UL320_.jpg,899.0,Camera & Photo
2104,"SWIFT SW350T 40X-2500X Magnification, Siedentopf Head, Research-Grade Trinocular Compound Lab Microscope with Wide-Field 10X and 25X Eyepieces, Mechanical Stage, Abbe Condenser, Camera-Compatible",71T+xQCFg1L._AC_UL320_.jpg,269.99,Camera & Photo
2105,"LILLIPUT A11 10.1"" 4K Camera Monitor with 4K HDMI and 3G-SDI Input & Loop Output 1920x1200 Full HD Resolution",71rHele2UmL._AC_UL320_.jpg,329.0,Camera & Photo
2106,"ORCATORCH D710V Underwater Video Light - 2000 Lumens, Tri-Color Light Sources (White, Red, Violet), 120-Degree Wide Beam Scuba Flashlight for Dive Photography Fill Light and Fluorescent Night Diving",711-ODiQiqL._AC_UL320_.jpg,139.95,Camera & Photo
2107,"SYNCO Wireless Lavalier Microphones & System, G1(A2) Pro Lapel Mic Dual Pack with Charging Case Noise Cancellation 492FT 8H for Online Class/Vlog/YouTube/Tiktok, Wireless-Lavalier-Mic-for-Camera",71frYfQXwOL._AC_UL320_.jpg,129.0,Camera & Photo
2108,SONY HDRCX240/L Video Camera with 2.7-Inch LCD - Blue (Renewed),41tsZXPYPYL._AC_UL320_.jpg,194.0,Camera & Photo
2109,Nikon NIKKOR Z MC 50mm f/2.8 | Compact macro prime lens for Z series mirrorless cameras | Nikon USA Model,71zIc78sc3L._AC_UL320_.jpg,646.95,Camera & Photo
2110,"Canon RF50mm F1.8 STM for Canon Full Frame Mirrorless RF Mount Cameras [EOS R, EOS RP, EOS R5, EOS R6](4515C002) (Renewed) Black",61ZZE+5zGhL._AC_UL320_.jpg,157.99,Camera & Photo
2111,X4 CPL 77mm Circular Polarizer Filter - Schott B270 - MRC16 - Nano Coating - Weather Sealed - 25 Year Support by Breakthrough Photography,51lWHm-z07L._AC_UL320_.jpg,149.0,Camera & Photo
2112,"MEIJIA Portable IP67 Waterproof Protective Hard Case,Camera Case With Customizable Fit Foam Insert, Elegant Black, 24.25""X19.43""X8.68""",517QwT20WeL._AC_UL320_.jpg,159.99,Camera & Photo
2113,Tamron 100-400mm F/4.5-6.3 VC USD Telephoto Zoom Lens for Canon Digital SLR Cameras (6 Year Limited USA Warranty),71Q2twRz1AL._AC_UL320_.jpg,799.0,Camera & Photo
2114,Rsrteng IPC-9800MOVTADHS Plus+ Full Features CCTV Camera Tester 7-inch IPS Touch Screen Monitor CCTV Tester with HD-TVI HD-CVI AHD SDI IP Camera Support DMM OPM VFL TDR Features POE 4K HDMI,71+m6RNk95L._AC_UL320_.jpg,649.99,Camera & Photo
2115,Nikon AF-S FX NIKKOR 24-70mm f/2.8G ED Zoom Lens with Auto Focus for Nikon DSLR Cameras,71NFmoXyeGL._AC_UL320_.jpg,1596.95,Camera & Photo
2116,"ZOMEI Z669C Carbon Fiber Portable Tripod with Ball Head Compact Travel for Canon,Sony, Nikon, Samsung, Panasonic, Olympus, Kodak, Fuji, Cameras and Video Camera",818ZrBzq3AL._AC_UL320_.jpg,119.99,Camera & Photo
2117,Zhiyun Weebill S Compact Gimbal Stabilizer for DSLR & Mirrorless Camera Sony A7M3 A7III A7R3 with 24-70mm GM Len Nikon Z6 Z7 Panasonic GH5 GH5s Canon 5D4 5D3 EOS R BMPCC 4K 3-Axis Handheld Weebills,71Fp0RYtJ8L._AC_UL320_.jpg,279.0,Camera & Photo
2118,"Neewer 660 PRO RGB Led Video Light with APP Control, 50W Video Lighting 360°Full Color, CRI 97+ with Barndoor/U Bracket for Gaming, Streaming, YouTube, Webex, Broadcasting, Web Conference, Photography",71LHBH0UhjS._AC_UL320_.jpg,145.49,Camera & Photo
2119,"SmallRig Lightweight Base Plate Riser System with Dual 15mm Rod Clamp, Base Plate Magnesium Alloy Version, w/Plate for Manfrotto Style, 40% Lighter - 3067",61UjaNXxuqL._AC_UL320_.jpg,138.99,Camera & Photo
2120,"Neewer Photo Studio Light Box, 24” × 24” Shooting Light Tent with Adjustable Brightness, Foldable and Portable Tabletop Photography Lighting Kit with 120 LED Lights and 4 Colored Backdrops",71poZxMhmdL._AC_UL320_.jpg,119.69,Camera & Photo
2121,JINTU 135mm f/2.8 Camera Lens MF Telephoto Compatible with Canon EOS EF/EF-S 4000D 200D 250D 5D IV 90D 60D 70D 77D 80D 850D 650D 750D 550D 450D 7D T7i T7s T7 T6s T6i T6 T5i T5 SL2 SL1 Camera,61cH61633QL._AC_UL320_.jpg,149.0,Camera & Photo
2122,Kase Wolverine Revolution 82mm Pro ND Filter Kit Magnetic Shockproof Tempered Optical Glass w Color Coded Rings inc CPL ND8 ND64 ND1000 Lens Cap & Case,81WwVVEqNgL._AC_UL320_.jpg,439.95,Camera & Photo
2123,"5 Pack of Kodak Professional Ektachrome E100 Color Film (35mm, 36 Exposures)",71H1G84T50L._AC_UL320_.jpg,123.97,Camera & Photo
2124,"10"" HDMI LCD Digital Microscope 1500X,Coin Microscope for Adults with 16MP Camera Sensor,Soldering Microscope with LED Lights Touch Control,TV/Windows/Mac Compatible,Gift with Coin Guidebook",813Y0nWSWmL._AC_UL320_.jpg,259.99,Camera & Photo
2125,VILTROX 23mm f/1.4 X-Mount Lens Auto Focus F1.4 Large Aperture APS-C Lens for fujifilm X-Mount Camera X-T3 X-H1 X20 T30 X-T20 X-T100 X-Pro2 Black,61-E5DUx93S._AC_UL320_.jpg,299.0,Camera & Photo
2126,F5 Prox 5.5 Inch 1600nit Hight Bright DSLR Camera Field Monitor Touchscreen Waveform 3D LUT F970 External Kit Install for Power Wireless Transmission 1920x1080 4K HDMI in Out Type-c Input,618v5QvZ2PL._AC_UL320_.jpg,159.99,Camera & Photo
2127,"Godox SL-60W Kit with Softbox and 2.8M Stainless Steel Light Stand LED Video Light 5600K Studio Continuous Lamp Bowens Mount Wirelessly Adjust Photo Lights for YouTube, Wedding, Outdoor Shooting",61-AR-aoYfL._AC_UL320_.jpg,229.99,Camera & Photo
2128,Freewell 82mm Versatile Magnetic Variable ND (VND) Filter System,81Gb2XS0PyL._AC_UL320_.jpg,399.99,Camera & Photo
2129,Zhiyun Crane 3S Pro Kit [Official] Handheld 3-Axis Gimbal Stabilizer for DSLR Cinema Cameras and Camcorder (PRO Package),71w+WD5vAwL._AC_UL320_.jpg,849.0,Camera & Photo
2130,"Maven B1.2 42mm ED Binoculars (10X42, Gray/Orange)",81ygE83o2tL._AC_UL320_.jpg,1000.0,Camera & Photo
2131,"Nixplay 8 inch Touch Screen Smart Digital Picture Frame with WiFi (W08K), Black-Silver, Share Photos and Videos Instantly via Email or App",71SlJIb+WZL._AC_UL320_.jpg,135.82,Camera & Photo
2132,"Intelligent Flight Battery for DJI Mavic 2/Mavic 2 Pro/Mavic 2 Zoom,31 Mins Max Flight Time 3850mAh 15.4V Intelligent Flight Batteries Replacement",61-ecYhGmwL._AC_UL320_.jpg,129.99,Camera & Photo
2133,Canon EOS Rebel T7 Digital SLR Camera Body Only (Kit Box) (Renewed),61WWccJctiL._AC_UL320_.jpg,312.0,Camera & Photo
2134,"Feiyu SCORP-C 3-Axis Handheld Gimbal Camera Stabilizer for DSLR and Mirrorless Camera for Sony A6300/6400 A7S3 A7R,Canon EOS R,M50,80D,NikonD750/Z5/Z6, 5.51lbs Payload Professional Video Stabilizer",61RBO6lR-DL._AC_UL320_.jpg,269.0,Camera & Photo
2135,"DM202 Max Digital Microscope 1500x, Coin Microscope with Lights,25MP HDMI Soldering Microscope for Adults, LCD Microscope with Screen, Microsocpe for Electronics Repair, PC/TV Compatible, 32GB",71IsY9EmSqL._AC_UL320_.jpg,259.99,Camera & Photo
2136,"Gosky Tripod -Travel Portable Tripod for Spotting scopes, Binoculars, camcorders, or SLR Cameras (Pro Tripod (61-inch))",61R1QZ6r46L._AC_UL320_.jpg,106.99,Camera & Photo
2137,"Olympus M.Zuiko Digital MC-20, 2X Teleconverter",71GmG3ibVoL._AC_UL320_.jpg,429.99,Camera & Photo
2138,Ricoh Theta SC2 360-Degree 4K Spherical VR Camera (White) Bundle with Flexible 10-Inch Spider Tripod (2 Items),41SdqupnKRL._AC_UL320_.jpg,326.95,Camera & Photo
2139,Sigma 56mm F1.4 DC DN for EF-M Mount (351971),81WeZYA48EL._AC_UL320_.jpg,389.0,Camera & Photo
2140,"Pelican Vault - V300 Multi-Purpose Hard Case with Padded Dividers for Camera, Drone, Equipment, Electronics, and Gear (Black)",61zPe+uQOpL._AC_UL320_.jpg,119.95,Camera & Photo
2141,Nikon 70-300mm f/4.5-5.6G ED IF AF-S VR Nikkor Zoom Lens for Nikon Digital SLR Cameras (Renewed),71Xez29Mg1L._AC_UL320_.jpg,399.19,Camera & Photo
2142,"KN-21C 21inch 53cm Dimmable 3000~6000K Bi-Color LED Ring Light with Tripod and Phone Holder,with Remote, for Makeup, Selfie, Vlog, YouTube Video, Camera (2PCS)",71ml90ceKXL._AC_UL320_.jpg,189.0,Camera & Photo
2143,Canon Rf 85mm F1.2 L USM Ds,61N-b+oF84L._AC_UL320_.jpg,2799.0,Camera & Photo
2144,"Dory Underwater Drone - Palm-Sized 1080p Full HD Underwater Drone with Camera for Real Time Viewing, APP Remote Control and Portable with Carrying Case, WiFi Buoy and 49 ft Tether, ROV",61t7ohiwAXL._AC_UL320_.jpg,499.0,Camera & Photo
2145,Olympus Tough TG-6 Digital Camera (Black) with Essential Accessory Bundle – Includes: SanDisk Ultra 64GB SDXC Memory Card + 2X Extended Life Seller's Replacement Batteries with Charger + More,81kRv8EeuKL._AC_UL320_.jpg,519.99,Camera & Photo
2146,"Panasonic X1500 4K Professional Camcorder with 24X Optical Zoom, WiFi HD Live Streaming, HC-X1500 (USA Black)",611Zj0f+RqL._AC_UL320_.jpg,1697.99,Camera & Photo
2147,"Lumitec Lighting 101511, LED Underwater Light, SeaBlaze Quattro Underwater Light, Dual Color White / Blue, One Size,Bronze",6189WIYebbL._AC_UL320_.jpg,279.99,Camera & Photo
2148,"Elikliv ERM101 7"" Digital Microscope, 1200X Soldering Microscope for Adults,1080P Video Coin Microscope with Ring Light,12MP Coin Magnifier, IPS Screen, PC View, Electronic Repair Mat Included, 32GB",71Fp2HCd9rL._AC_UL320_.jpg,139.99,Camera & Photo
2149,LS C300D II COB Light Storm 300d Mark II 350W 5500K Daylight Balanced Led Video Light CRI 96+ TLCI96+ 45000lux@0.5m with The Reflector 8 Built-in Lighting FX Low V-Mount,71ENlxppebL._AC_UL320_.jpg,949.0,Camera & Photo
2150,"SmallRig R5 R5 C R6 Cage Kit for Canon R5 R5 C R6 Mirrorless Camera with Top Handle and Dedicated Cable Clamp, Aluminum Alloy Cage for Canon R5 R6 R5 C Camera 3234",71vLkwcLYeL._AC_UL320_.jpg,169.0,Camera & Photo
2151,"Came-TV Mini V Mount Battery 99Wh 6875mAh 15A Draw Rechargeable V-Mount with 2 D-TAP & 1 USB for Blackmagic BMPCC 4k/6K Pro/Sony FX6/Red Komodo/Canon C70/Z cam E2,Video Lights,Monitors",61agC11YTZL._AC_UL320_.jpg,160.0,Camera & Photo
2152,"FOSITAN Bi-Color Dimmable Photo Light Box Kit, 32x32 inch/80x80 cm Photo Studio Photography Photo Box Kit 2 Led Light Bars 252 LED Light Beads Tabletop Professional Shooting Tent with 5 Backdrops",71cfs0m12LL._AC_UL320_.jpg,139.98,Camera & Photo
2153,"SanDisk Industrial 8GB Micro SD Memory Card Class 10 UHS-I MicroSD (Bulk Pack) in Cases (SDSDQAF3-008G-I) Bundle with (1) Everything But Stromboli Card Reader (8GB, Pack of 50)",91JobxtPzHS._AC_UL320_.jpg,260.83,Camera & Photo
2154,"Atomos Ninja V 5"" 4K HDMI Recording Monitor with WD Blue SSD(500GB) Essential Bundle – Includes: Atomos 5"" Accessory Kit + Microfiber Cleaning Cloth",71iBLdexuLL._AC_UL320_.jpg,519.0,Camera & Photo
2155,"19-inch Dual-WiFi Digital Photo Frame - Digital Picture Frame, 32GB, Motion Sensor, Full Function, Sharing Photos and Videos via App or Email Instantly, Unlimited Cloud Storage, Wall Mountable",71vi6JZl4FL._AC_UL320_.jpg,269.99,Camera & Photo
2156,Celestron - PowerSeeker 80EQ Telescope - Manual German Equatorial Telescope for Beginners - Compact and Portable - BONUS Astronomy Software Package - 80mm Aperture,61iiQ85dieL._AC_UL320_.jpg,173.79,Camera & Photo
2157,NIKON 24-85mm F/3.5-4.5G ED VR AF-S Nikkor Lens - White Box,718vFdKCs8L._AC_UL320_.jpg,496.95,Camera & Photo
2158,"Lume Cube Edge Lit Mini Ring Light - Ring Light with Tripod Stand and Phone Holder - Monitor Circle Light for Photos, Videos & Video Calls - Includes Clamp Mount & Built-in Smart LED Screen",61rJK2frhML._AC_UL320_.jpg,179.99,Camera & Photo
2159,Blackmagic Design Video Assist 5&quot; 12G-SDI HDMI HDR Recording Monitor,711CCIQ5m-L._AC_UL320_.jpg,795.0,Camera & Photo
2160,PolarPro 77mm Peter McKinnon Variable ND Filter | Signature Edition II (2-5 Stop),61CdnSGKaAL._AC_UL320_.jpg,249.95,Camera & Photo
2161,Godox SA-17 Kit for Godox SA-P Projector to Bowens Mount S30 VL150 VL200 VL300 SL200II LED Continuous Light with Godox SA-P Projection Attachment + Godox SA-06 Iris + Godox SA-09-003/004 + Godox SA-10,71oWK9aqv-L._AC_UL320_.jpg,271.0,Camera & Photo
2162,Nikon Travelite 12x25mm Black Binoculars,51GYi6yjn5L._AC_UL320_.jpg,106.95,Camera & Photo
2163,Olympus Tough TG-6 Digital Camera (Red) with 64GB Memory Card | Strap & Case,81GHSiiYYlL._AC_UL320_.jpg,515.0,Camera & Photo
2164,"GVM Video Light, 80W Photography Lighting for Video Recording, 2700K~7500K Bi-Color Bowens Mount softbox Lighting kit, CRI 97+ 8 Lighting Scenes Continuous Lighting for Photography",71eyC7p8eRL._AC_UL320_.jpg,199.0,Camera & Photo
2165,Sigma 105mm F2.8 EX DG OS HSM Macro Lens for Canon SLR Camera,81eXcy1+aXL._AC_UL320_.jpg,549.0,Camera & Photo
2166,Zhumell Z114 Portable Altazimuth Reflector Telescope,7175quzJ0cL._AC_UL320_.jpg,239.99,Camera & Photo
2167,"Neewer Clamshell Light Reflector Diffuser with Carrying Bag, 66”×24”/155x61cm Photography Curved Lighting Reflector for Photo Studio Photography, Black/White/Gold/Silver Colors (Stand Not Included)",61mUyqJG93S._AC_UL320_.jpg,119.99,Camera & Photo
2168,"Godox SL100Bi 100W Bi-Color LED Video Light, 32100Lux@1M with Godox RC-A6 Remote Controller, 2800K-6500K CRI/TLCI 96+/97+ LED Studio Light, 11 FX Effects Studio LED Continuous Video Light Bowens Mount",71CfoWrJveL._AC_UL320_.jpg,229.0,Camera & Photo
2169,"DJI Avata Pro-View Combo (DJI Goggles 2) - With RC Motion 2 Flymore Kit, 3 batteries First-Person View Drone UAV Quadcopter with 4K Stabilized Video, Built-in Propeller Guard, With 128gb Micro SD, Backpack, Landing Pad and More Bundle",71x34tadLXL._AC_UL320_.jpg,1979.0,Camera & Photo
2170,AmScope - SM-4NTP 7X-45X Simul-Focal Stereo Lockable Zoom Microscope on Dual Arm Boom Stand,618nvkzRSlL._AC_UL320_.jpg,504.99,Camera & Photo
2171,Fujinon XF8-16mmF2.8R LM WR Lens,81Sq7-HjXeL._AC_UL320_.jpg,1499.0,Camera & Photo
2172,Sony FDR-AX700 4K HDR Camcorder (Renewed),81T7RWpTPNL._AC_UL320_.jpg,1304.95,Camera & Photo
2173,"Flycam 5000 Handheld Camera Stabilizer with Comfort Arm Vest. Precise Balancing, Smooth & Fatigueless Operations. Quick Shock Absorption, Free Quick Release, Arm Brace & Table Clamp (FLCM-CMFT-KIT)",61w-yBU+aZS._AC_UL320_.jpg,275.0,Camera & Photo
2174,Nikon FTZ II - Adapter for F-Mount Lenses on Z-Mount Cameras,71Py1MLMrgL._AC_UL320_.jpg,227.16,Camera & Photo
2175,"C40 2K FHD Conference Webcam, All-in-1 Ultra Wide-Angle 120° Video Conference Camera with 4 Microphones&Speakers, 5X Zoom with Remote Control, 16ft Voice Pickup, AI Noise-Cancel, USB Plug&Play",61neBa1f1VL._AC_UL320_.jpg,249.99,Camera & Photo
2176,"Heavy Duty Tripod, Camera Video Tripod with Fluid Head Aluminum Twin Tube 74.4 inch, Max Loading 17.6 LBS, for Canon Nikon Sony DSLR Camcorder Camera",71gH8IPQYKL._AC_UL320_.jpg,149.99,Camera & Photo
2177,"DM201 SE 7"" Digital Microscope 1200X with IPS Screen, 1080P Coin Microscope Magnifier for Error Coins, LCD Soldering Microscope, PC View, 32GB",71MJ0hYruHL._AC_UL320_.jpg,111.99,Camera & Photo
2178,Neewer BP-2CH Dual Channel V-Mount/V Lock Battery Charger with DC 16.5V Power Supply Output Compatible with Any V-Mount Battery (XLR Cable/Battery Not Included),61-CQvbPu2L._AC_UL320_.jpg,125.69,Camera & Photo
2179,"Meliaebag Mirrorless Camera Purse for Women, Stylish Genuine Leather Camera Bag Crossbody Hobo Shoulder carry Case",81PYE1BK3fL._AC_UL320_.jpg,159.0,Camera & Photo
2180,Sigma 24-70mm f/2.8 DG DN Art Lens for Sony E Mount with Altura Photo Advanced Photo and Travel Bundle,81zvEq+HlPS._AC_UL320_.jpg,1099.0,Camera & Photo
2181,"Godox 35x160cm 14""x63"" Beehive Honeycomb Grid Strip Softbox Bowens Mount for Studio Flash (2pcs)",51nMRmqf9hL._AC_UL320_.jpg,119.99,Camera & Photo
2182,F5 Prox+NP-F970 Battery+Charger with Case 5.5 inch High Bright Camera Field Monitor Touch Screen 1600nit 1920 * 1080 4K HDMI Broadcast Monitor for Film Studio,71-+q+rhTnL._AC_UL320_.jpg,169.99,Camera & Photo
2183,"Bushnell Powerview 10x42 BoneCollector Binoculars, Adult Binoculars for All Purpose Use in Realtree Edge Camo",81RAMKYoK0L._AC_UL320_.jpg,100.37,Camera & Photo
2184,"13 Piece Telescope Accessory Kit - 1.25"" Telescope Eyepiece and Filter Set with a Sturdy Carry Case - 5pcs Plossl Telescope Eyepieces - 2X Barlow Lens - 7pcs Filters",81zxw1cTw5L._AC_UL320_.jpg,139.99,Camera & Photo
2185,Power DSLR Camera Cage with MB-600 Matte Box Combo Kit (FC-CTH-01),71E68YI09NL._AC_UL320_.jpg,140.0,Camera & Photo
2186,Lekufee Waterproof Carrying Case Compatible with DJI Mavic 3 Pro/DJI Mavic 3 Classic/DJI Mavic 3/Cine/Combo/DJI RC Pro/DJI RC/RC N1/Goggles 2/Integra/DJI Motion/RC Motion 2 and Accessories(Case Only),71TxrJproQL._AC_UL320_.jpg,134.99,Camera & Photo
2187,Nikon NIKKOR Z 17-28mm f/2.8 | Large aperture wide-angle zoom lens for Z series mirrorless cameras | Nikon USA Model,51eOq6aQUqL._AC_UL320_.jpg,1196.95,Camera & Photo
2188,Sony SEL16F28 16mm f/2.8 Wide-Angle Lens for NEX Series Cameras,61bgY70zptL._AC_UL320_.jpg,249.99,Camera & Photo
2189,"Sky-Watcher EQM-35 – Fully Computerized GoTo German Equatorial Telescope Mount – Belt-driven, Astrophotography ready, Computerized Hand Controller with 42,900+ Celestial Object Database,White",61EBmN3HUZL._AC_UL320_.jpg,970.0,Camera & Photo
2190,"comica VM30 Shotgun Microphone - Professional Wireless Mic for Camera, Smartphone, and PC with 70/150Hz, 328' Range, USB C Digital Output- Perfect for Video Recording, Podcasting, and Vlogging",71LowH8JahL._AC_UL320_.jpg,189.0,Camera & Photo
2191,TOKINA ATX-i 11-16mm F2.8 Canon EF,71WHAR2Ik7L._AC_UL320_.jpg,399.0,Camera & Photo
2192,"SONGING FXLION Nano Two 98WH Tiny V-Mount/V-Lock Battery with Type-C, D-tap, USB A, Micro USB for Cameras, Camcorders,Large LED Lights, Monitors, MacBook and Smartphone",61WXyRzxPDL._AC_UL320_.jpg,279.0,Camera & Photo
2193,SEETEC P173-9HSD 17.3 Inch 1920x1080 Desktop Monitor for Broadcast LCD Monitoring with 3G-SDI HDMI AV YPbPr,61DXtdcacML._AC_UL320_.jpg,529.99,Camera & Photo
2194,"Godox AD200 Strobe Flash Monolight, 200Ws Pocket Flash Light, 2.4G TTL 1/8000 HSS Speedlite with 2900mAh Li-ion Battery, Bare Bulb Flash Head to Provide 500 Full Power Flashes, Recycle in 0.01-2.1s",716TpgEd5PL._AC_UL320_.jpg,299.0,Camera & Photo
2195,Olympus OM System M.Zuiko Digital ED 40-150mm F4.0 PRO for Micro Four Thirds System Camera Compact Powerful Zoom Weather Sealed Design Fluorine Coating,713VOVHE8fL._AC_UL320_.jpg,899.99,Camera & Photo
2196,"Canon 9518B002-cr EF 16-35mm f/4L is USM Lens (Renewed), Black",71JSKQpZCwL._AC_UL320_.jpg,615.0,Camera & Photo
2197,Canon EOS 250D / Rebel SL3 Digital SLR Camera Body w/Canon EF-S 18-55mm f/3.5-5.6 Lens 3 Lens DSLR Kit Bundled with Complete Accessory Bundle + 64GB + Flash+ Case & More- International Model (Renewed),716FiUUS36L._AC_UL320_.jpg,699.95,Camera & Photo
2198,"CD324 Carbon Fiber Video Monopod Kit, with Fluid Head and Removable feet, 71 Inch Max Load 13.2 LB for Canon Nikon Sony Olympus Panasonic DSLR Camera",61SsD0fJ9gL._AC_UL320_.jpg,126.99,Camera & Photo
2199,"Canon IVY Mini Printer + 60 Sheets of ZINK Photo Paper Sticker (Incl 10 Bonus), Bluetooth Portable Mobile Pocket Compact Printer for Instant Print from Your Smartphone + Hard Carrying Case - Rose Gold",61+xNUJF50L._AC_UL320_.jpg,149.99,Camera & Photo
2200,Fujifilm Fujinon XF150-600mmF5.6-8 R LM OIS WR Lens,61ju4LZRd3L._AC_UL320_.jpg,1999.0,Camera & Photo
2201,"instax Hybrid Instant Camera and Printer, Bluetooth, Blush Gold, LiPlay",816ssaQ2CgL._AC_UL320_.jpg,154.0,Camera & Photo
2202,"ZEISS Batis 85mm f/1.8 Lens for Sony E Mount Mirrorless Cameras, Black",61cZX2rCLTL._AC_UL320_.jpg,1249.0,Camera & Photo
2203,"Smart Digital Picture Frame Large Digital Photo Frame - 21.5 inch App Frames 1920x1080 IPS No Touchscreen, 32GB, Remote Control, Synchronize Smartphone Screen, Send Photos Quickly, Free Cloud Storage",81nBkcgbDCL._AC_UL320_.jpg,289.99,Camera & Photo
2204,Tamron SP 150-600mm F/5-6.3 Di VC USD G2 for Canon Digital SLR Cameras,514--vDkFhL._AC_UL320_.jpg,1399.0,Camera & Photo
2205,"AmScope SE400-Z Professional Binocular Stereo Microscope, WF10x and WF20x Eyepieces, 10X and 20X Magnification, 1X Objective, LED Lighting, Boom-Arm Stand, 110V-120V",71DZAS2ROiL._AC_UL320_.jpg,229.99,Camera & Photo
2206,"NEEWER 12""x47"" Rectangular Softbox Quick Set up Folding Strip Soft Box Bowens Mount with Diffusers/Honeycomb Grid/Bag Compatible with Aputure 120d Godox SL60w NEEWER CB60 and Other Lights, SF30120Q",61JyjISaXSL._AC_UL320_.jpg,129.49,Camera & Photo
2207,Tamron 24-70mm F/2.8 G2 Di VC USD G2 Zoom Lens for Nikon Mount,81TM8BrdJCL._AC_UL320_.jpg,1199.0,Camera & Photo
2208,Tamron 28-75mm f/2.8 Di III VXD G2 Lens for Sony E Mount with Altura Photo Advanced Accessory and Travel Bundle,812L--ujmyL._AC_UL320_.jpg,799.0,Camera & Photo
2209,Nikon AF-P DX NIKKOR 18-55mm f/3.5-5.6G VR Lens for Nikon DSLR Cameras,61pA3HRWkDL._AC_UL320_.jpg,246.95,Camera & Photo
2210,"NEEWER Q3 200Ws 2.4G TTL Flash (2nd Version), 1/8000 HSS Strobe Light Photography Monolight with QPRO-N Trigger Compatible with Nikon, Diffuser/3200mAh Battery/500 Full Power Pops/Recycle in 0.01-1.8s",719-Hi22rJL._AC_UL320_.jpg,249.99,Camera & Photo
2211,"2 Pack RGB LED Video Light Wand Stick, LUXCEO Photography Studio Lighting Kits with 29"" to 81"" Tripod & Remote Control, Dimmable Photography Light Wand 36 Colors 3000K-6000K",71qsDN0DQBL._AC_UL320_.jpg,119.99,Camera & Photo
2212,"Matterport Portable Tripod Camera Stand Extendable Up to 62"" Universal Four Section Professional Tripod Mount Compatible with All Cameras",611TN6wWHeL._AC_UL320_.jpg,149.99,Camera & Photo
2213,Original Inspire 2/Ronin 2/Ronin 4D Tb50 Intelligent Fligh Battery(4280mah) Compatible for DJI Inspire 2/Ronin 2/Ronin 4D Original Intelligent Flight Battery (2 Pack) 3,411l4rjNdQL._AC_UL320_.jpg,325.95,Camera & Photo
2214,"NOMATIC McKinnon Camera Backpack 25L - Backpack, Ladder & 2 Small Camera Cubes",41Jyp5lW8sL._AC_UL320_.jpg,389.99,Camera & Photo
2215,Tamron 18-400mm f/3.5-6.3 Di II VC HLD Lens for Canon EF (AFB028C-700) + Bundle Package Kit - International Version (1 Year Wty),815YTO3tGbL._AC_UL320_.jpg,684.96,Camera & Photo
2216,"Atomos Ninja V 5"" 4K HDMI Recording Monitor with Deluxe Accessory Bundle – Includes: 2X Extended Life NP-F975 Batteries with Charger; Micro, Mini, Standard HDMI Cables; Action Grip Stabilizer & More",813B9I+8StL._AC_UL320_.jpg,449.0,Camera & Photo
2217,"TC-1 Wirless Timecode Box 3 Kit,2.4G Radio,Timecode Accuracy 0.5ppm,Bluetooth 5.0,Max Range 250FT, Support APP Control",61rDcRuBL9L._AC_UL320_.jpg,549.0,Camera & Photo
2218,"Kodak Step Touch | 13MP Digital Camera & Instant Printer with 3.5 LCD Touchscreen Display, 1080p HD Video - Editing Suite, Bluetooth & Zink Zero Ink Technology | White",715STWBO9pL._AC_UL320_.jpg,129.99,Camera & Photo
2219,"NEEWER Vertical 2.4G Battery Grip Replacement for BG-R10 with 2.4G Remote Control, Compatible with Canon EOS R5 R5C R6 R6 Mark II Mirrorless Cameras Using LP-E6/LP-E6N/LP-E6NH Batteries (BG-R10RC-L)",81YRwsk6dIL._AC_UL320_.jpg,109.99,Camera & Photo
2220,Feit Electric Portable LED Inflatable Ball Light - 6-Bright Color Changing Options - Tripod and Carrying Case Included - Perfect for Parties and Events,31RKS5EwLIL._AC_UL320_.jpg,168.64,Camera & Photo
2221,Sony Vertical Grip for Alpha 7R IV - VG-C4EM,81dgC5oQbAL._AC_UL320_.jpg,398.0,Camera & Photo
2222,"10.1 Inch 16GB Smart WiFi Digital Picture Frame, Send Photos or Small Videos from Anywhere, Touch Screen, 800x1280 IPS LCD Panel, Portrait and Landscape(Black)",81ygSq5gr-L._AC_UL320_.jpg,105.99,Camera & Photo
2223,Osee G7 7Inch New Version 3000 Nits Ultra Bright DSLR Camera Field HDR Monitor 1920×1200 3D LUT 3G SDI 4K HDMI in&Out Include Arm Trestle Dtap Cable V Mount Battery Plate Sunshade Pelican Case,71XBvpISzbL._AC_UL320_.jpg,499.0,Camera & Photo
2224,"Case Club Case fits Mac Studio Display. Heavy Duty, Airline Approved, Shippable - Also Fits Mac Studio, Mac Mini, Keyboard & Accessories - Compact, Rolling, Lockable, Waterproof, Hard Case",81hxEkAtJgL._AC_UL320_.jpg,349.95,Camera & Photo
2225,"EP6 Plus 4K Video Camcorder Wearable Vlog Camera, Vlog Video Camera UHD 1080P 60FPS Hands-Free Head Mounted Camera with EIS 6.0 Anti-Shake, 32G Micro SD Card, Smart Remote",61DwJfD8T5L._AC_UL320_.jpg,139.99,Camera & Photo
2226,"FIFISH V-EVO 4K60FPS Underwater Drone Kit with Robotic Arm, QYSEA AI Vision Lock 360° Omnidirectional Movement Underwater ROV with Depth Hold, Portable Robot with VR Control, Posture Lock (330ft Dive)",61ogkmpW6jL._AC_UL320_.jpg,1599.0,Camera & Photo
2227,"Super HD 1080P 4-Channel Hybrid 4-in-1 DVR Security Recorder with 1TB Hard Drive, for 2MP TVI/AHD/CVI/Analog Cameras (Cameras Not Included)",61ET6Ix-oNL._AC_UL320_.jpg,189.99,Camera & Photo
2228,WiFi Digital Picture Frame | The Best Photo Frame for Family | Alexa Built-in | Free Unlimited Storage | Send Photos from Anywhere | Easy Setup | Personalized Gift,71UIKkDIMlL._AC_UL320_.jpg,145.99,Camera & Photo
