id,title,img,price,category
0,"Eureka NEC185 Cordless Stick Vacuum Cleaner Convenient for Hard Floors, Rechargeable Handheld Vacuum Cleaner Portable with Powerful Motor Efficient Suction,White",716X0z1KILL._AC_UL320_.jpg,152.99,Vacuum Cleaners & Floor Care
1,"Hoover Power Scrub Deluxe Carpet Cleaner Machine, Upright Shampooer, FH50150NC, Red, 27",71zMtxB9xTL._AC_UL320_.jpg,181.36,Vacuum Cleaners & Floor Care
2,Prolux Core Floor Buffer - Heavy Duty Single Pad Commercial Floor Polisher and Tile Scrubber,71+t-F84jDS._AC_UL320_.jpg,499.99,Vacuum Cleaners & Floor Care
3,"Shark NV356E Navigator Lift-Away Professional Upright Vacuum with Swivel Steering, HEPA Filter, XL Dust Cup, Pet Power, Dusting Brush, and Crevice Tool, Perfect for Pet Hair, White/Silver",61OsbGCnrqL._AC_UL320_.jpg,199.99,Vacuum Cleaners & Floor Care
4,Tineco iFLOOR 3 Breeze Complete Wet Dry Vacuum Cordless Floor Cleaner and Mop One-Step Cleaning for Hard Floors,71rvT22VH3L._AC_UL320_.jpg,279.99,Vacuum Cleaners & Floor Care
5,"Dyson V15 Detect Cordless Vacuum Cleaner, Multicolor, 10.5""L x 9.8""W x 49.6""H",613doEjslUL._AC_UL320_.jpg,580.0,Vacuum Cleaners & Floor Care
6,"Homeika Cordless Stick Vacuum Cleaner, 20Kpa Powerful Suction Vacuum Cleaner with LED Display, 30 Min Runtime Detachable Battery, 1.5L Dust Cup, for Carpet and Hard Floor Pet Hair (Pink)",71UUT0jU68L._AC_UL320_.jpg,109.99,Vacuum Cleaners & Floor Care
7,"BISSELL Crosswave Pet Pro All in One Wet Dry Vacuum Cleaner and Mop for Hard Floors and Area Rugs, Purple, 2306A",71z3BuuN8AL._AC_UL320_.jpg,267.99,Vacuum Cleaners & Floor Care
8,"EyeVac PRO Touchless Vacuum - 1400 Watts Professional Vacuum with Active Infrared Sensors, High Efficiency Filtration, Bag-Less Canister (Tuxedo Black)",61Ar-zMYZvL._AC_UL320_.jpg,199.0,Vacuum Cleaners & Floor Care
9,"Simplicity Jill Canister Vacuum Cleaner, Hardwood Floor Vacuum with Dual-Certified HEPA Vacuum Filter and Bag, Small and Compact Stair Vacuum, Jill.12",71DiB4JTLqL._AC_UL320_.jpg,159.99,Vacuum Cleaners & Floor Care
10,"Bissell CleanView Swivel Rewind Pet Reach Vacuum Cleaner, with Quick Release Wand, Swivel Steering and Automatic Cord Rewind, 3197A (Color may vary),Black",71usUuW2W-L._AC_UL320_.jpg,145.0,Vacuum Cleaners & Floor Care
11,"FABULETTA Cordless Vacuum Cleaner, Strong Brushless Motor with 24Kpa Max Suction, 6 in 1 Lightweight Stick Vacuum Cleaner with 45 Min Max Runtime Detachable Battery for Hardfloor Carpet Pet Hair, Blue",61dFEq7opYL._AC_UL320_.jpg,119.99,Vacuum Cleaners & Floor Care
12,"Bissell Steam Mop, Steamer, Tile, Hard Wood Floor Cleaner, 1806, Sapphire Powerfresh Deluxe",71FgnTXKDqL._AC_UL320_.jpg,102.95,Vacuum Cleaners & Floor Care
13,"VacLife 25Kpa Cordless Stick Vacuum Cleaner, 6-in-1 Cordless Vacuum w/Strong Suction for Home Pet Hair Carpet Hard Floor, Max 45 Min Runtime, Wireless Vaccine Cleaner w/LED Headlights, Black (VL732)",71TbFwCKe+L._AC_UL320_.jpg,199.99,Vacuum Cleaners & Floor Care
14,"Dyson V11 Cordless Stick Vaccum, Large, Nickel/Blue",51PGx0DtJ6L._AC_UL320_.jpg,462.0,Vacuum Cleaners & Floor Care
15,"BISSELL Pet Hair Eraser Turbo Rewind Vacuum, Lightweight, Automatic Cord Rewind, Tangle-Free Brush Roll, Headlights, Powerful Pet Hair Pickup, SmartSeal Allergen System, Blue, 27909",71bg2hfBogL._AC_UL320_.jpg,228.09,Vacuum Cleaners & Floor Care
16,"Fykee Cordless Vacuum Cleaner, 80,000 PRM Vacuum Cleaner with 2200 mAh Battery and 2 Adjustable Model, Rotated LED Brush Head Detachable Stick Vacuum up to 35 Mins Runtime",61qBYPEOxoL._AC_UL320_.jpg,149.99,Vacuum Cleaners & Floor Care
17,"Robot Vacuum and Mop Combo, WiFi/App/Alexa, Robotic Vacuum Cleaner with Schedule, 2 in 1 Mopping Robot Vacuum with Watertank and Dustbin, Self-Charging, Slim, Ideal for Hard Floor, Pet Hair, Carpet",71VRtX5V1RL._AC_UL320_.jpg,176.56,Vacuum Cleaners & Floor Care
18,"Vactidy T6 Robot Vacuum, Slim, Quiet, Automatic Self-Charging Robotic Vacuum Cleaner, Daily Schedule Cleaning, 2.4GHz WiFi/App/Alexa/Siri Control, Good for Pet Hair, Hard Floor and Low Pile Carpet",71SFDFB5LrL._AC_UL320_.jpg,159.89,Vacuum Cleaners & Floor Care
19,"Hoover ONEPWR Evolve Pet Cordless Small Upright Vacuum Cleaner, Lightweight Stick Vac, For Carpet and Hard Floor, BH53422V, Black",61BOJpzCNIL._AC_UL320_.jpg,179.99,Vacuum Cleaners & Floor Care
20,"iRobot Braava Jet M6 (6110) Ultimate Robot Mop- Wi-Fi Connected, Precision Jet Spray, Smart Mapping, Works with Alexa, Ideal for Multiple Rooms, Recharges and Resumes, White",81rv10KuoWL._AC_UL320_.jpg,399.0,Vacuum Cleaners & Floor Care
21,"Robot Vacuums,3000Pa Powerful Suction Self-Charging Robotic Vacuum Cleaner,4400mAh Battery Life Robotic Vacuums Sweeper, Automatic Self-Charging, Ideal for Pet Care, Hard Floor & Medium-Pile Carpet",610MsZeqiML._AC_UL320_.jpg,128.99,Vacuum Cleaners & Floor Care
22,"Sanitaire SC679K Tradition Upright Commercial Bagged Vacuum, Red",61MzTQDBTXL._AC_UL320_.jpg,149.99,Vacuum Cleaners & Floor Care
23,"Kenmore DS4065 Cordless Stick Vacuum 1L Capacity Lightweight Cleaner 2-Speed Power Suction LED Headlight 2-in-1 Handheld for Hardwood Floor, Carpet & Dog Hair, Blue",511rFyKnACL._AC_UL320_.jpg,116.99,Vacuum Cleaners & Floor Care
24,"Shark ZU782 Rotator Lift-Away DuoClean Pro Upright Vacuum with Self-Cleaning Brushroll, DuoClean, HEPA Filter, Headlights, Swivel Steering, Upholstery Tool, Pet Power Brush & Crevice Tool, Sage Green",712-pmkQFML._AC_UL320_.jpg,389.99,Vacuum Cleaners & Floor Care
25,"Belife BVC12 Cordless Vacuum Cleaners for Home, Stick Vacuum for Pet Hair Hardwood Floor Carpet, 22KPa Wireless Vacuum with 380W Brushless Motor, 17500mAh Battery Up to 45mins Runtime",61CTOWlLSRL._AC_UL320_.jpg,139.99,Vacuum Cleaners & Floor Care
26,"ILIFE V5s Plus Robot Vacuum and Mop Combo with Wi-Fi/App/Alexa, Automatic Self-Charging Robotic Vacuum Cleaner, Slim and Quiet, Cleans Hard Floors Carpets and Pet Hair (V5s Pro Upgrade Version)",71qn3Ub5aOL._AC_UL320_.jpg,179.99,Vacuum Cleaners & Floor Care
27,"Bissell SpinWave Cordless Hard Floor Expert, 23159, Titanium With Electric Blue Accents",710hBJOsN9L._AC_UL320_.jpg,154.49,Vacuum Cleaners & Floor Care
28,"Shark CZ2001 Vertex Canister Vacuum, Bagless, Corded, with Self-Cleaning Brushroll & DuoClean PowerFins, HEPA Anti-Allergen Filter, MultiFLEX Technology, 2 Attachments & LED Headlights, Black & Copper",71icevAFsrL._AC_UL320_.jpg,189.99,Vacuum Cleaners & Floor Care
29,"Roomie Tec Cordless Vacuum Cleaner, 2 in 1 Handheld Vacuum, High-Power 2200mAh Li-ion Rechargeable Battery, with Corner Lighting and Upright Charging Base",71cSQpVohuL._AC_UL320_.jpg,109.99,Vacuum Cleaners & Floor Care
30,"Shark IZ462H Vertex Ultra Lightweight Cordless Stick Vacuum with DuoClean PowerFins, Crevice, Pet Multi-Tool, Anti-Allergen, Brush, Removable Handheld, Flex, 60 min Runtime, Blue, MultiFLEX",71keuH8wQYL._AC_UL320_.jpg,415.46,Vacuum Cleaners & Floor Care
31,"NGTeco Robot Vacuum Cleaner 2500Pa Suction Self-Charging Robotic Vacuums Works in Wi-Fi Connection, Voice Control, Good for Pet Hair, Carpet and Hard Floors",81T4fA5SMbL._AC_UL320_.jpg,189.0,Vacuum Cleaners & Floor Care
32,"Shark ZU561 Navigator Lift-Away Speed Self Cleaning Brushroll Lightweight Upright Vacuum with HEPA Filter, Red Peony",71RqYPiCIaL._AC_UL320_.jpg,239.99,Vacuum Cleaners & Floor Care
33,"Wyze Cordless Vacuum Cleaner with 24Kpa Powerful Suction, Lightweight Stick with HEPA Filter, 450W Powerful Brushless Motor , 50mins Runtime for Home Hard Floor Carpet Pet Hair",61R4rmycQCL._AC_UL320_.jpg,179.98,Vacuum Cleaners & Floor Care
34,EVERYBOT Three-Spin Robot Mop - Ultra Quiet Smart Mopping Robot Cleaner Only | Powerful Stylish 3 Spin Wet Mop for Hard Floor & Tile Cleaning with Remote Control | Large Water Tank,71KbNm8Zw+L._AC_UL320_.jpg,349.0,Vacuum Cleaners & Floor Care
35,"Roanow Cordless Vacuum Cleaner, 400W/33KPA Cordless Vacuum with LED Display, 55Mins Runtime Lightweight & Ultra-Quiet Cordless Stick Vacuum for Carpet and Floor, Home, Pet Hair Cleaning",71PJw2ChPSL._AC_UL320_.jpg,149.99,Vacuum Cleaners & Floor Care
36,"Cordless Vacuum Cleaner, Handheld Vacuum with 25Kpa Super Suction, Hand Vacuum Cleaner Cordless 4-in-1 Powerful Lightweight Vacuum Cleaner, Up to 35 Mins Runtime, for Home Hard Floor Carpet Pet Hair",81fiakviM3L._AC_UL320_.jpg,139.98,Vacuum Cleaners & Floor Care
37,"McCulloch MC1385 Deluxe Canister Steam Cleaner with 23 Accessories, Chemical-Free Pressurized Cleaning for Most Floors, Counters, Appliances, Windows, Autos, and More, 1-(Pack), Black",81k+BSRw2oL._AC_UL320_.jpg,180.49,Vacuum Cleaners & Floor Care
38,"Shark HV343AMZ Rocket Corded Stick Vacuum with Self-Cleaning Brushroll, Lightweight & Maneuverable, Perfect for Pet Hair Pickup, Converts to a Hand Vacuum, with Crevice & Upholstery Tools, Blue/Silver",71ytBiVH88L._AC_UL320_.jpg,149.99,Vacuum Cleaners & Floor Care
39,"BISSELL® CrossWave® HydroSteam™  Wet Dry Vac, Multi-Purpose Vacuum, Wash, and Steam, Sanitize Formula Included, 35151",512B-qxvJwL._AC_UL320_.jpg,299.99,Vacuum Cleaners & Floor Care
40,"iRobot Roomba i3 EVO (3150) Wi-Fi Connected Robot Vacuum – Now Clean by Room with Smart Mapping Works with Alexa Ideal for Pet Hair Carpets & Hard Floors, Roomba i3",81Sr8suy3fL._AC_UL320_.jpg,249.0,Vacuum Cleaners & Floor Care
41,"Foppapedretti Cordless Vacuum Cleaner, 4 in 1 Hand Vacuum Cleaner Cordless, 2200mAh Handheld Vacuum Rechargeable, Hardwood Floor Pet Hair for Home",81jYnhVC8DL._AC_UL320_.jpg,139.88,Vacuum Cleaners & Floor Care
42,"Shark HV301 Rocket Ultra-Light Corded Bagless Vacuum for Carpet and Hard Floor Cleaning with Swivel Steering, Gray/Orange",7135gJlVfzL._AC_UL320_.jpg,169.99,Vacuum Cleaners & Floor Care
43,"iRobot Roomba i3+ EVO (3550) Self-Emptying Robot Vacuum – Now Clean by Room with Smart Mapping, Empties Itself for Up to 60 Days, Works with Alexa, Ideal for Pet Hair, Carpets, Roomba i3+",51c6piKhqCL._AC_UL320_.jpg,399.0,Vacuum Cleaners & Floor Care
44,"Shark ION Robot Vacuum for Carpet AV751 Wi-Fi Connected, 120min Runtime, Works with Alexa, Black",71wklzkp2bL._AC_UL320_.jpg,149.99,Vacuum Cleaners & Floor Care
45,"Hoover Powerscrub XL Pet Carpet Cleaner Machine, Upright Shampooer, FH68002, Black, Large",715EwZ+AffL._AC_UL320_.jpg,249.99,Vacuum Cleaners & Floor Care
46,"ZCWA Robot Vacuum and Mop Combo, 2 in 1 Mopping Robotic Vacuum with WiFi/App/Alexa, Robotic Vacuum Cleaner, Schedule Settings, Self-Charging, Ideal for Hard Floor, Pet Hair and Carpet",71rMVuF8+bL._AC_UL320_.jpg,175.99,Vacuum Cleaners & Floor Care
47,"Shark NV752 Rotator Powered Lift-Away TruePet Upright Vacuum with HEPA Filter, Large Dust Cup Capacity, LED Headlights, Upholstery Tool, Pet Power Brush & Crevice Tool, Perfect for Pets, Bordeaux",71UOeCNh4WL._AC_UL320_.jpg,319.99,Vacuum Cleaners & Floor Care
48,"Robot Vacuum and Mop Combo, 3 in 1 Mopping Robotic Vacuum with Schedule, App/Bluetooth/Alexa, 1600Pa Max Suction, Self-Charging Robot Vacuum Cleaner, Slim, Ideal for Hard Floor, Pet Hair, Carpet",71PFBQjwViL._AC_UL320_.jpg,179.95,Vacuum Cleaners & Floor Care
49,"Kenmore DS1030 Cordless Stick Vacuum Lightweight Cleaner 2-Speed Power Suction LED Headlight 2-in-1 Handheld for Hardwood Floor, Carpet & Pet Hair, White",61WSf2zQ1SL._AC_UL320_.jpg,119.99,Vacuum Cleaners & Floor Care
50,"Miele Classic C1 Turbo Team Bagged Canister Vacuum, Tech Blue - Portable, Household",61KiVC7d6wL._AC_UL320_.jpg,375.2,Vacuum Cleaners & Floor Care
51,Bissell Big Green Professional Carpet Cleaner,61ABtuIJhnL._AC_UL320_.jpg,387.99,Vacuum Cleaners & Floor Care
52,"Dyson V15 Detect Cordless Vacuum Cleaner, Yellow/Nickel",51uSS9tb-uL._AC_UL320_.jpg,589.0,Vacuum Cleaners & Floor Care
53,"DEWALT 20V Vacuum, Cordless Handheld Vacuum, HEPA, Battery Not Included (DCV501HB), Yellow",61hkpyWdYlL._AC_UL320_.jpg,140.99,Vacuum Cleaners & Floor Care
54,"BISSELL 24613 Pet Hair Eraser Turbo Plus Lightweight Vacuum, Tangle-Free Brush Roll, Powerful Pet Hair Pick-up, SmartSeal Allergen System, Specialized Pet Tools, Easy Empty",61DueplEW+L._AC_UL320_.jpg,219.99,Vacuum Cleaners & Floor Care
55,"Hoover Smartwash Automatic Carpet Cleaner, FH52000, Turquoise 43.5 Inches",71h0HEbQF-L._AC_UL320_.jpg,229.99,Vacuum Cleaners & Floor Care
56,"Kenmore KW2001 Portable Carpet Spot Cleaner & Pet Stain Vacuum, Gray",71ihr7pYjpL._AC_UL320_.jpg,149.99,Vacuum Cleaners & Floor Care
57,"AIRROBO Robot Vacuum Cleaner with 2800Pa Suction Power, App Control, 120 Mins Runtime, Self-Charging Robotic Vacuum Cleaner for Low Carpet, Pet Hair, Hard Floors, P20",81wCNXD4F0L._AC_UL320_.jpg,129.99,Vacuum Cleaners & Floor Care
58,"Kenmore 81214 200 Series Bagged Canister Vacuum Cleaning Tools, Orange",517WLxRjZFL._AC_UL320_.jpg,219.99,Vacuum Cleaners & Floor Care
59,"Miele Classic C1 Pure Suction Bagged Canister Vacuum, Graphite Grey - Portable, Household",61hWP9f69CL._AC_UL320_.jpg,334.9,Vacuum Cleaners & Floor Care
60,"iRobot Roomba j7+ (7550) Self-Emptying Robot Vacuum – Avoids Common Obstacles Like Socks, Shoes, and Pet Waste, Empties Itself for 60 Days, Smart Mapping, Works with Alexa",712hw6D54KL._AC_UL320_.jpg,600.0,Vacuum Cleaners & Floor Care
61,"Wagner Spraytech C900054 905e AutoRight Multi-Purpose Steam Cleaner, 12 Accessories Included, Power Steamer for cleaning, Color May Vary",61PmY983ddL._AC_UL320_.jpg,114.71,Vacuum Cleaners & Floor Care
62,"Hoover WindTunnel Cord Rewind Pro Bagless Upright Vacuum Cleaner, For Carpet and Hard Floors, UH71300V, Black",51EUOnuv2CL._AC_UL320_.jpg,108.99,Vacuum Cleaners & Floor Care
63,"BuTure Cordless Vacuum Cleaner, 400W 33Kpa Powerful Stick Vacuum with 55min Runtime Detachable Battery, Touch Display and 1.2L Large Dust Cup, Vacuum Cleaners for Hardwood Floor Carpet Car Pet",61WFQMlqqhL._AC_UL320_.jpg,199.99,Vacuum Cleaners & Floor Care
64,"BISSELL ProHeat 2X Revolution Pet Pro Plus, 3588F, Upright Deep Cleaner",71dYigilsTL._AC_UL320_.jpg,308.99,Vacuum Cleaners & Floor Care
65,"iRobot Roomba i4 EVO (4150) Wi-Fi Connected Robot Vacuum – Now Clean by Room with Smart Mapping Compatible with Alexa Ideal for Pet Hair Carpets & Hard Floors, Roomba i4",91Fxo+xCydL._AC_UL320_.jpg,280.0,Vacuum Cleaners & Floor Care
66,"Tineco Pure ONE S11 Cordless Vacuum Cleaner, Smart Stick Handheld Vacuum Strong Suction & Lightweight, Cordless Handheld Vacuum Deep Clean Hair, Hard Floor, Carpet, Car (Pure ONE S11 Grey)",6145AYqak1L._AC_UL320_.jpg,299.99,Vacuum Cleaners & Floor Care
67,"Belife BVC11 Cordless Vacuum Cleaner, 25Kpa Stick Vacuum Cleaners for Home Hardwood Floor Carpet Pet Hair, 380W Powerful Brushless Motor, Up to 40mins Runtime, LED Touch Display, Blue",61dPoVQzvmL._AC_UL320_.jpg,129.99,Vacuum Cleaners & Floor Care
68,"Vacuum Cleaners for Home, Cordless Vacuum Cleaner with 80000 RPM High-Speed Brushless Motor, 2600mAh Powerful Lithium Batteries, 5 Stages High Efficiency Filtration, Up to 40 Mins Runtime",71rfv2GwslL._AC_UL320_.jpg,149.99,Vacuum Cleaners & Floor Care
69,"INSE Cordless Vacuum Cleaner, 6-in-1 Stick Vacuum with 26Kpa 350W Suction, Max 50 Min Runtime Rechargeable Vacuum Cleaners for Home, Lightweight Household Vacuum for Hard Floor Pet Hair-S10",71V8FwTwXBL._AC_UL320_.jpg,129.89,Vacuum Cleaners & Floor Care
70,"Laresar Cordless Stick Vacuum Cleaner with Touch Screen, 400W/33000pa , Up to 50 Mins Runtime, Handheld Anti-Tangle , Edge Cleaning, Pet Hair, Carpet and Hardwood Floor",61R58ESIrlL._AC_UL320_.jpg,199.99,Vacuum Cleaners & Floor Care
71,"Shark AZ2002 Vertex Powered Lift-Away Upright Vacuum with DuoClean PowerFins, Self-Cleaning Brushroll, Large Dust Cup, Pet Crevice Tool, Dusting Brush & Power Brush, Silver/Rose Gold",71-5ABPNUwL._AC_UL320_.jpg,337.75,Vacuum Cleaners & Floor Care
72,"Vacuum Cleaner Cordless Vacuum Stick Cordless Vacuum Cleaner with 23Kpa Super Suction, 80000 RPM High-Speed Brushless Motor, Up to 35 Mins Runtime Lightweight Vacuum Cleaners for home Hardwood Floor",71R2Drq7MxL._AC_UL320_.jpg,149.99,Vacuum Cleaners & Floor Care
73,"Shark S5003D Genius Hard Floor Cleaning System Pocket Steam Mop, Burgundy/Gray",71jgPEG9+8L._AC_UL320_.jpg,117.64,Vacuum Cleaners & Floor Care
74,"BISSELL Little Green Proheat Portable Deep Cleaner/Spot Cleaner and Car/Auto Detailer with self-Cleaning HydroRinse Tool for Carpet and Upholstery, 2513E",91zBUhFKfWL._AC_UL320_.jpg,113.89,Vacuum Cleaners & Floor Care
75,"Kenmore 600 Series Friendly Lightweight Bagged Canister Vacuum with Pet PowerMate, Pop-N-Go Brush, 2 Motors, HEPA Filter, Aluminum Telescoping Wand, Retractable Cord and 4 Cleaning Tools, Purple",61kb-gr6MML._AC_UL320_.jpg,349.99,Vacuum Cleaners & Floor Care
76,"Lubluelu Cordless Vacuum Cleaner, 25Kpa Powerful Cordless Stick Vacuum with Self-Standing,50Mins Long Runtime, Lightweight Handheld Quiet Vacuum Cordless for Pet Hair, Carpet & Hardwood Floor",61SiCfuiufL._AC_UL320_.jpg,119.99,Vacuum Cleaners & Floor Care
77,"Shark HZ602 Ultralight Pet Pro Corded Stick Vacuum with PowerFins & Self-Cleaning Brushroll, Perfect for Pets, Converts to Hand Vacuum, Pet Power Brush, Crevice & Upholstery Tools, Comet Red",61azhqiOnrL._AC_UL320_.jpg,217.69,Vacuum Cleaners & Floor Care
78,"Hoover FloorMate Deluxe Hard Floor Cleaner Machine, Wet Dry Vacuum, FH40160PC, Silver",61yZtb-4G2L._AC_UL320_.jpg,139.99,Vacuum Cleaners & Floor Care
79,"BISSELL, 3061 Featherweight Cordless Stick Vacuum, Electric Blue, Black",71LElQxh+PL._AC_UL320_.jpg,128.74,Vacuum Cleaners & Floor Care
80,"Shark RV912S EZ Robot Vacuum with Self-Empty Base, Bagless, Row-by-Row Cleaning, Perfect for Pet Hair, Compatible with Alexa, Wi-Fi, Dark Gray",71Q3n6DjMwL._AC_UL320_.jpg,329.99,Vacuum Cleaners & Floor Care
81,"Aspiron Canister Vacuum Cleaner, 1200W Lightweight Bagless Vacuum Cleaner, 3.7QT Capacity, Automatic Cord Rewind, 5 Tools, HEPA Filter, Pet Friendly Vacuum Cleaner for Hard Floors, Carpet, Pet Hair",711QS071OkL._AC_UL320_.jpg,118.94,Vacuum Cleaners & Floor Care
82,"Lefant M210 Pro Robot Vacuum Cleaner, Tangle-Free 2200Pa Suction, Slim,Quiet, Self-Charging Wi-Fi/APP Remote Connected Robotic Vacuum Cleaner, Work with Alexa, Ideal for Pet Hair, Hard Floors",61dnn7UfZ2L._AC_UL320_.jpg,209.99,Vacuum Cleaners & Floor Care
83,"Belife S10 Cordless Vacuum Cleaner, Stick Vacuum Cleaners for Home Carpet and Hardwood Floor, Household Wireless Vacuum for Pet Hair, 22Kpa Powerful Digital Motor, Up to 40Min Runtime",710NFmfzojL._AC_UL320_.jpg,119.99,Vacuum Cleaners & Floor Care
84,Dyson Cyclone V10 Animal Cordless Vacuum Cleaner,51RO7pTXQvL._AC_UL320_.jpg,460.95,Vacuum Cleaners & Floor Care
85,"roborock Q Revo Robot Vacuum and Mop, Auto-Drying, Auto Mop Washing, Dual Spinning Mops, Auto Mop Lifting, Self-Refilling, Self-Emptying, Reactive Tech Obstacle Avoidance, 5500Pa Suction, Black",61A3pnOA0zL._AC_UL320_.jpg,899.99,Vacuum Cleaners & Floor Care
86,"Cordless Vacuum Cleaner, 450W Stick Vacuum Cleaner, OLED Color Screen Display, Up to 55mins, 8 Animation Modes, Multi-cone Filtration, Handheld Vacuum for Hardwood Floors, Carpets, Pet Hair S14",81oTBeCN3UL._AC_UL320_.jpg,199.99,Vacuum Cleaners & Floor Care
87,"Shark AI Ultra Voice Control Robot Vacuum with Matrix Clean Navigation, Home Mapping, 60-Day Capacity, Self-Empty Base for Homes with Pets (Silver/Black)",71pj2PO+biL._AC_UL320_.jpg,427.24,Vacuum Cleaners & Floor Care
88,"BISSELL Revolution HydroSteam Pet Carpet Cleaner, 3432, Upright, Multi",81-3REGGakL._AC_UL320_.jpg,399.99,Vacuum Cleaners & Floor Care
89,"WLUPEL Cordless Vacuum Cleaner, 33Kpa Stick Vacuum Cleaner, 400W Handheld Vacuum with LED Touch Screen, 50mins Runtime for Pet Hair, Carpet and Hardwood Floor(KB-H015)",618EgZyFMoL._AC_UL320_.jpg,199.99,Vacuum Cleaners & Floor Care
90,"BISSELL CleanView Swivel Pet Reach Full-Size Vacuum Cleaner, with Quick Release Wand, & Swivel Steering, 3198A, Color May Vary",61tRR0P86DL._AC_UL320_.jpg,139.04,Vacuum Cleaners & Floor Care
91,"roborock Q5+ Robot Vacuum with Self-Empty Dock, Hands-Free Cleaning for up to 7 Weeks, 2700Pa Max Suction, 180mins Max Run-Time, Compatible with Alexa, Perfect for Hard Floors, Carpets, and Pet Hair",61Uv25RUhbL._AC_UL320_.jpg,699.99,Vacuum Cleaners & Floor Care
92,"Bissell SpotBot Pet handsfree Spot and Stain Portable Deep Cleaner, Blue, 2117A",81vVJB8MsSL._AC_UL320_.jpg,185.39,Vacuum Cleaners & Floor Care
93,"Tikom Robot Vacuum and Mop, G8000 Robot Vacuum Cleaner, 2700Pa Strong Suction, Self-Charging, Good for Hard Floors, Black",714hksaF5dL._AC_UL320_.jpg,199.99,Vacuum Cleaners & Floor Care
94,"BISSELL CrossWave Floor and Area Rug Cleaner, Wet-Dry Vacuum with Bonus Brush-Roll and Extra Filter, 1785A , Green",71F29cVpWGL._AC_UL320_.jpg,249.99,Vacuum Cleaners & Floor Care
95,"BISSELL Power Steamer Heavy Duty 3-in-1 Steam Mop and Handheld SteamShot for Indoor and Outdoor Use:Garage, Workshop, Auto, Boat, Recreational Vehicles; Windows,Outdoor Furniture and Decks,Black,2685A",81AAroYEuaL._AC_UL320_.jpg,175.09,Vacuum Cleaners & Floor Care
96,"EICOBOT Cordless Vacuum Cleaner, 20000Pa High Efficiency Stick Vacuum, 6 in 1 Lightweight Quiet Vacuum Cleaner with 35min Long Runtime, Detachable Battery, for Hardwood Floor Pet Hair, Car, Crimson",71ZIncFpUTL._AC_UL320_.jpg,319.99,Vacuum Cleaners & Floor Care
97,"ORECK COMMERCIAL XL Pro 5 Super Compact Canister Bagged Vacuum Cleaner with Attachments, Lightweight, Carriable Portable Professional Grade, BB900-DGR, Black",71Be7MmeY-S._AC_UL320_.jpg,109.99,Vacuum Cleaners & Floor Care
98,"iRobot Roomba s9+ (9550) Self Emptying Robot Vacuum - Empties Itself for up to 60 Days, Detects & Cleans Around Objects in Your Home, Smart Mapping, Powerful Suction, Corner & Edge Cleaning",718mLGnc2-L._AC_UL320_.jpg,699.99,Vacuum Cleaners & Floor Care
99,"EICOBOT Robot Vacuum Cleaner, 2300Pa Strong Suction Power, Tangle-Free, Slim, Quiet, 120 Mins Runtime, Auto Self-Charging Robotic Vacuum Cleaner Ideal for Low Carpet, Pet Hair, Hard Floors, Black",716YyksfLcL._AC_UL320_.jpg,119.99,Vacuum Cleaners & Floor Care
100,"BuTure Cordless Vacuum Cleaner - 450W 33Kpa with Auto Mode Docking Station, Stick Vacuum Cleaner Handheld Wireless Household Vacuum Cleaner for Pet Hair Carpet and Hard Floor",61XhazAc9RL._AC_UL320_.jpg,199.99,Vacuum Cleaners & Floor Care
101,"Kärcher - S 4 Twin Walk-Behind Outdoor Hand Push Sweeper - 5.25 Gallon Capacity - 26.8"" Sweeping Width - Sweeps up to 26,000 ft²/Hour,Yellow",61aKh3EGdyL._AC_UL320_.jpg,137.9,Vacuum Cleaners & Floor Care
102,"BLACK+DECKER Powerseries Extreme Cordless Stick Vacuum Cleaner for Pets, Purple (BSV2020P)",71H-RcX3A0L._AC_UL320_.jpg,159.0,Vacuum Cleaners & Floor Care
103,"Shark NV105 Navigator Light Upright Vacuum with Large Dust Cup Capacity, Duster Crevice Tool & Upholstery Tool for Dependable Multi-Surface Cleaning, Blue",41TZylPb-lL._AC_UL320_.jpg,129.99,Vacuum Cleaners & Floor Care
104,"BuTure Cordless Vacuum Cleaner, 450W 33KPA Stick Vacuum with Color Touch Display, Up to 55Mins, Rechargeable Cordless Vacuum for Hardwood Floor Carpet Pet Hair",71l4gAu5FML._AC_UL320_.jpg,199.99,Vacuum Cleaners & Floor Care
105,Bissell Little Green ProHeat Machine - Portable Carpet & Upholstery Steam Cleaner,9110jd18uZL._AC_UL320_.jpg,129.99,Vacuum Cleaners & Floor Care
106,"Fykee Vacuum Cleaner, Cordless Vacuum Cleaner with 1.2L Dust Cup and 80,000 PRM Brushless Motor, Stick Vacuum Cleaner with Large Detachable Battery up to 35 mins Run Time (Red)",61FEBb180TL._AC_UL320_.jpg,149.99,Vacuum Cleaners & Floor Care
107,"DEVOAC 28Kpa Cordless Vacuum Cleaner, 350W Powerful Stick Vacuum Cleaner with Self-Standing, 45 Min Max Runtime, 6 in 1 Lightweight Wireless Vacuum Cleaner for Hardwood Floor Carpet Pet Hair",61gNkGA4JvL._AC_UL320_.jpg,119.99,Vacuum Cleaners & Floor Care
108,"Shark IQ App-Controlled Self-Emptying Robot Vacuum, RV100AE/UR1000SR - Black (Renewed)",515NCPTCdFL._AC_UL320_.jpg,349.95,Vacuum Cleaners & Floor Care
109,"Shark WD101 HydroVac XL 3-in-1 Vacuum, Mop & Self-Cleaning System with Antimicrobial Brushroll* & Solution for Multi-Surface , Perfect for Hardwood, Tile, Marble, Area Rug & More, Corded, Navy",71X6NgHXrVL._AC_UL320_.jpg,216.99,Vacuum Cleaners & Floor Care
110,"Shark AV2501S AI Ultra Robot Vacuum, with Matrix Clean, Home Mapping, 30-Day Capacity HEPA Bagless Self Empty Base, Perfect for Pet Hair, Wifi, Dark Grey",71gISOb7A+L._AC_UL320_.jpg,519.71,Vacuum Cleaners & Floor Care
111,"ZCWA Robot Vacuum, Robot Vacuum and Mop Combo with Schedule, Self-Charging Robot Vacuum Cleaner Compatible with WiFi/APP/Alexa, Perfect for Pet Hair, Hard-Floor and Carpet",71UyHjAwfyL._AC_UL320_.jpg,169.99,Vacuum Cleaners & Floor Care
112,"Shark AV993 IQ Robot Vacuum, Self Cleaning Brushroll, Advanced Navigation, Perfect for Pet Hair, Compatible with Alexa, Wi Fi , Black",71nLM5kjcQL._AC_UL320_.jpg,199.99,Vacuum Cleaners & Floor Care
113,Dyson V8 Animal Cordless HEPA Vacuum Cleaner + Direct Drive Cleaner Head + Wand Set + Mini Motorized Tool + Dusting Brush + Docking Station + Combination Tool + Crevice Tool,712lTXRmg1L._AC_UL320_.jpg,386.23,Vacuum Cleaners & Floor Care
114,"Bissell SpinWave Cordless PET Hard Floor Spin Mop, 23157, Voilet, Green, Silver",71PQUgfAlSL._AC_UL320_.jpg,154.49,Vacuum Cleaners & Floor Care
115,"Hoover Commercial PORTAPOWER Lightweight Canister Vacuum Cleaner with Attachments, Portable Carriable Handheld Small Professional Grade Bagged, 8 Pounds, CH30000, Black",71qJDafh3+L._AC_UL320_.jpg,129.0,Vacuum Cleaners & Floor Care
116,"Shark ZU102 Rotator Pet Upright Vacuum with PowerFins HairPro & Odor Neutralizer Technology, Charcoal, 2.9 L Dust Cup",71VZxmvpSPL._AC_UL320_.jpg,279.99,Vacuum Cleaners & Floor Care
117,"iRobot Roomba i4+ EVO (4552) Self Emptying Robot Vacuum - Empties Itself for up to 60 Days, Clean by Room with Smart Mapping, Compatible with Alexa, Ideal for Pet Hair, Carpets",71b1+HyxfjL._AC_UL320_.jpg,416.02,Vacuum Cleaners & Floor Care
118,"Foppapedretti Cordless Vacuum Cleaner, 6 in 1 Multifunction Cordless Stick Vacuum, 2200mAh Vacuum Cleaner Rechargeable, Lightweight Vacuum Cleaner Hardwood Floor Pet Hair Home Rd08",81jAAhvbdcL._AC_UL320_.jpg,129.98,Vacuum Cleaners & Floor Care
